annotation_id,value,value_en,img_file_path,nc_img_file_path,audio_file_path
ANN-0239,この頃消防車とかあったのか？火消し？,Did they even have fire engines back then? Or was it all bucket brigades?,/statistical-data/img-at/ANN-0239.png,/statistical-data/img-at-nc/ANN-0239.png,
ANN-0240,昭和49.50.51と火事騒がぐっと減る 定義変わった？,"Fires drop sharply in Showa 49, 50, and 51. Did the definition change?",/statistical-data/img-at/ANN-0240.png,/statistical-data/img-at-nc/ANN-0240.png,
ANN-0241,料金改正のせい？,Because of the rate revision?,/statistical-data/img-at/ANN-0241.png,/statistical-data/img-at-nc/ANN-0241.png,
ANN-0242,下がってる,It's going down.,/statistical-data/img-at/ANN-0242.png,/statistical-data/img-at-nc/ANN-0242.png,
ANN-0243,ブラック終了？,Did exploitative labor finally end?,/statistical-data/img-at/ANN-0243.png,/statistical-data/img-at-nc/ANN-0243.png,
ANN-0244,3倍強,A little over three times as much.,/statistical-data/img-at/ANN-0244.png,/statistical-data/img-at-nc/ANN-0244.png,